{
  "report_schema": "0.1",
  "spec_version": "0.1",
  "register_version": "2026.1",
  "profile": "1",
  "hold_basis": "system_of_record",
  "floor_basis": "owned_store",
  "implementation": {
    "name": "changeover-reference",
    "version": "0.1.0"
  },
  "bindings": [
    "http",
    "in_process"
  ],
  "binding_coverage": [
    {
      "binding": "http",
      "exercised": true,
      "classes": [
        "C-FLOOR",
        "C-REVOKE",
        "C-SUBST",
        "C-SEATMAP",
        "C-CLAIM",
        "C-ORIGIN",
        "C-AUTHZ",
        "C-ABSENCE",
        "C-REFUSE",
        "C-CLOCK",
        "C-LOG",
        "C-USAGE",
        "C-PROFILE0"
      ]
    },
    {
      "binding": "in_process",
      "exercised": true,
      "classes": [
        "C-ATOMIC",
        "C-BUDGET",
        "C-FANOUT",
        "C-IDEMPOTENT",
        "C-RELEASE",
        "C-ORPHAN",
        "C-PII-INGEST",
        "C-INJECT"
      ]
    }
  ],
  "run_at": "2026-08-25T21:48:56.553618+00:00",
  "trials": 471,
  "selection": {
    "only": null
  },
  "classes": [
    {
      "class": "C-SCHEMA",
      "spec_row": "Every emitted document validates; unknown members rejected on write, ignored on read.",
      "status": "unprovable",
      "reason": "no module in this repository runs C-SCHEMA: the harness has nothing to import, so the class was not executed. A module at packages/conformance/src/classes/c-schema.ts exporting the contract in packages/conformance/src/classes/_contract.ts would put it in this report",
      "binding": null,
      "clauses": [],
      "missing_path": "packages/conformance/src/classes/c-schema.ts"
    },
    {
      "class": "C-CAPABILITY",
      "spec_row": "The document validates, is served from a venue-authorised origin, and no limit observed at runtime is absent from it.",
      "status": "unprovable",
      "reason": "no module in this repository runs C-CAPABILITY: the harness has nothing to import, so the class was not executed. A module at packages/conformance/src/classes/c-capability.ts exporting the contract in packages/conformance/src/classes/_contract.ts would put it in this report",
      "binding": null,
      "clauses": [],
      "missing_path": "packages/conformance/src/classes/c-capability.ts"
    },
    {
      "class": "C-ETAG",
      "spec_row": "Two independent implementations produce byte-identical JCS bytes and digest for a pinned golden fixture.",
      "status": "unprovable",
      "reason": "no module in this repository runs C-ETAG: the harness has nothing to import, so the class was not executed. A module at packages/conformance/src/classes/c-etag.ts exporting the contract in packages/conformance/src/classes/_contract.ts would put it in this report",
      "binding": null,
      "clauses": [],
      "missing_path": "packages/conformance/src/classes/c-etag.ts"
    },
    {
      "class": "C-FLOOR",
      "spec_row": "owned_store hard-fails at one violation; measured_warranty reports floor_violations as a rate against a published threshold and does not hard-fail below it. floor_ms never increases post-grant; expires_at >= floor_deadline; operator_overrides reported separately.",
      "status": "unprovable",
      "binding": "http",
      "source": "packages/conformance/src/classes/c-floor.ts",
      "duration_ms": 836.8309589999999,
      "clauses": [
        {
          "clause": "C-FLOOR.published",
          "status": "pass",
          "note": "floor_basis owned_store, 24 observations, min retention 300000ms less 30000ms margin — warranting 270000ms"
        },
        {
          "clause": "C-FLOOR.ceiling_warranted",
          "status": "pass",
          "note": "the ceiling this Server advertises (policy_max_floor_ms 270000ms) is inside what its own evidence warrants (270000ms) — a Server MUST NOT grant a floor it has not measured, and the ceiling is the largest floor it offers to grant"
        },
        {
          "clause": "C-FLOOR.ceiling_control",
          "status": "pass",
          "note": "and the unclamped default ceiling (300000ms) is NOT warranted by this evidence, so the clause above is a measurement rather than a constant — a site publishing the default unchanged fails it"
        },
        {
          "clause": "C-FLOOR.granted_warranted",
          "status": "pass",
          "note": "5 floors granted across the published range (1000→1000, 60000→60000, 120000→120000, 270000→270000, 330000→270000), every one of them inside the evidence"
        },
        {
          "clause": "C-FLOOR.clamped_not_refused",
          "status": "pass",
          "note": "a request above the ceiling is granted AT the ceiling (330000 → 270000), which is the published limit doing its job rather than a refusal an agent cannot act on"
        },
        {
          "clause": "C-FLOOR.floor_never_increases",
          "status": "pass",
          "note": "floor_ms observed 8 times across five reads, an idempotent replay and a hand-off, never above the granted 120000ms (120000)"
        },
        {
          "clause": "C-FLOOR.floor_replay_identical",
          "status": "pass",
          "note": "and the replay carries the identical floor member rather than a freshly computed one, which is what makes a retry safe to trust"
        },
        {
          "clause": "C-FLOOR.floor_store",
          "status": "pass",
          "note": "and the store holds the same number, so the constancy is the Hold's and not the projection's"
        },
        {
          "clause": "C-FLOOR.floor_ms_ungrantable",
          "status": "pass",
          "note": "the agent role cannot write floor_ms at all (42501): the column is absent from its UPDATE grant, so T1's immovability does not depend on no code trying"
        },
        {
          "clause": "C-FLOOR.floor_derived_enforced",
          "status": "pass",
          "note": "and moving floor_deadline away from granted_at + floor_ms is refused by the store even as its owner (23514 hold_floor_derived)"
        },
        {
          "clause": "C-FLOOR.no_extend_verb",
          "status": "pass",
          "note": "and §6.3 declares 9 routes of which none extends a Hold — there is no extend verb for a floor to grow through, which is the third independent reason this holds"
        },
        {
          "clause": "C-FLOOR.expiry_check_enforced",
          "status": "pass",
          "note": "and an UPDATE that would put expires_at one second inside the floor is refused by the store (23514 hold_expiry_not_before_floor), so T2 is a constraint and not a convention"
        },
        {
          "clause": "C-FLOOR.owned_store_clean",
          "status": "pass",
          "note": "this Server publishes floor_basis owned_store and 0 of its Holds stopped holding inside their floor, so the class passes on the evidence rather than by default"
        },
        {
          "clause": "C-FLOOR.owned_store_hard_fails",
          "status": "pass",
          "note": "one Hold whose seats stopped holding 120s inside its floor is enough: under owned_store there is no rate for a single violation to be small in (1 counted)"
        },
        {
          "clause": "C-FLOOR.override_not_a_violation",
          "status": "pass",
          "note": "an Operator Override took a Hold's seats inside its floor and floor_violations did not move (1 → 1) — T1a counts it separately and it does not fail this class"
        },
        {
          "clause": "C-FLOOR.override_counted",
          "status": "pass",
          "note": "while operator_overrides did move, which is the whole point of keeping the two numbers apart: an honest exhibitor withdrawing seats must not read as non-conforming"
        },
        {
          "clause": "C-FLOOR.expiry_not_before_floor",
          "status": "pass",
          "note": "across every one of this principal's 2 Holds in the store, 1 of them handed off, not one carries expires_at below floor_deadline"
        },
        {
          "clause": "C-FLOOR.measured_warranty_rate",
          "status": "unprovable",
          "note": "§7 and T1a both require measured_warranty to report floor_violations as a rate \"against a published threshold\", and no member of the eight frozen document schemas publishes one: capability.schema.json carries floor_evidence.violations (a count from the measurement window, not a tolerance) and hold-policy.schema.json carries abandonment_floor_penalty_bp (X5's, about an agent's abandonment rate, not the Server's floor). With no publishable threshold there is nothing for a rate to be below, so the branch cannot be decided by any harness — including against a site that published measured_warranty, which this one does not"
        }
      ],
      "reason": "C-FLOOR.measured_warranty_rate: §7 and T1a both require measured_warranty to report floor_violations as a rate \"against a published threshold\", and no member of the eight frozen document schemas publishes one: capability.schema.json carries floor_evidence.violations (a count from the measurement window, not a tolerance) and hold-policy.schema.json carries abandonment_floor_penalty_bp (X5's, about an agent's abandonment rate, not the Server's floor). With no publishable threshold there is nothing for a rate to be below, so the branch cannot be decided by any harness — including against a site that published measured_warranty, which this one does not"
    },
    {
      "class": "C-ATOMIC",
      "spec_row": "200 concurrent holds on a 100-seat house: exactly 100 succeed, 100 typed 409, zero oversell, zero partial holds, zero 40P01.",
      "status": "pass",
      "binding": "in_process",
      "source": "packages/conformance/src/atomic/assertions.ts",
      "duration_ms": 456.9737499999974,
      "clauses": [
        {
          "clause": "C-ATOMIC.3",
          "status": "pass",
          "note": ".3 — seat A:1 is claimed: the customer completed at the exhibitor's own checkout"
        },
        {
          "clause": "C-ATOMIC.3",
          "status": "pass",